{
  "$schema": "https://json-schema.org/draft/2020-12/schema",
  "$id": "https://raw.githubusercontent.com/brpowell/spiral/main/libs/spk-format/schemas/theme-v1.schema.json",
  "title": "Spiral theme pack v1",
  "type": "object",
  "required": ["id", "authorId", "version", "name", "author", "description", "tokens"],
  "additionalProperties": false,
  "properties": {
    "authorId": {
      "type": "string",
      "minLength": 1,
      "maxLength": 64,
      "pattern": "^[a-z0-9]+(?:-[a-z0-9]+)*$",
      "description": "Structured slug identifying who maintains/distributes this item. Effective id is authorId.type.id. Independent of the freeform author credit."
    },
    "version": {
      "type": "string",
      "pattern": "^\\d+\\.\\d+\\.\\d+(?:[-+][0-9A-Za-z.-]+)?$",
      "description": "Semver content version of this item build."
    },
    "minAppVersion": {
      "type": "string",
      "pattern": "^\\d+\\.\\d+\\.\\d+(?:[-+][0-9A-Za-z.-]+)?$",
      "description": "Optional semver floor of the Spiral app that can load this item."
    },
    "$schema": {
      "type": "string",
      "format": "uri-reference",
      "description": "JSON Schema reference for editor validation."
    },
    "id": {
      "type": "string",
      "minLength": 1,
      "maxLength": 64,
      "pattern": "^[a-z0-9]+(?:-[a-z0-9]+)*$",
      "description": "Declared item id. Effective id is authorId.type.id."
    },
    "name": {
      "type": "string",
      "maxLength": 80,
      "description": "Human-readable display label. May be empty on workshop drafts."
    },
    "author": {
      "type": "string",
      "maxLength": 80,
      "description": "Freeform credit for the contribution's creator. Independent of pack.json authorId (pack maintainer/distributor)."
    },
    "description": {
      "type": "string",
      "maxLength": 280,
      "description": "Short summary for lists/cards; keep longer notes in the pack README."
    },
    "tokens": {
      "type": "object",
      "additionalProperties": { "type": "string" },
      "description": "CSS custom property tokens. Required keys are enforced before apply; workshop drafts may omit keys while saving."
    }
  }
}
