{
  "$schema": "https://raw.githubusercontent.com/brpowell/spiral/main/libs/spk-format/schemas/theme-v1.schema.json",
  "id": "strawberry",
  "authorId": "spiral",
  "version": "1.0.0",
  "name": "Strawberry",
  "author": "Spiral",
  "description": "Ripe strawberry on blush paper. A sweet, light take on Sprig.",
  "tokens": {
    "color-bg": "#fbf0ee",
    "color-text-primary": "#3b1d26",
    "color-accent": "#e0476b",
    "color-danger": "#b3321f",
    "color-alert-info": "#6a5a8c",
    "color-alert-success": "#4e8a3a",
    "color-alert-warning": "#a8701c",
    "radius-card": "12px",
    "radius-button": "8px",
    "radius-input": "8px",
    "font-ui": "'Inter', system-ui, -apple-system, sans-serif"
  }
}
